name,description,image,type,latlong
The Alake of Egba Palace,Points of Interest & Landmarks,https://www.freeiconspng.com/thumbs/no-image-icon/no-image-icon-10.png,Points of Interest & Landmarks,"[7.1643044, 3.352938]"
Loveseal Church,Churches & Cathedrals,https://www.freeiconspng.com/thumbs/no-image-icon/no-image-icon-10.png,Churches & Cathedrals,"[6.6022218, 3.3533396]"
"LIVING FAITH CHURCH MASHI, KATSINA STATE",Churches & Cathedrals,https://www.freeiconspng.com/thumbs/no-image-icon/no-image-icon-10.png,Churches & Cathedrals,"[12.7262937, 7.73186305]"
Silverbird Cinemas,"My Visit to Silverbird cinemas was very exclusive, interesting and exciting as a result of the serene environment and...",https://www.freeiconspng.com/thumbs/no-image-icon/no-image-icon-10.png,Cinemas,"[7.74777585, 5.4234594]"
The Henna Place,I visited the henna place in Lekki with a friend and I was really impressed with the way the service was rendered. I'm...,https://dynamic-media-cdn.tripadvisor.com/media/photo-o/0e/aa/f2/76/getlstd-property-photo.jpg?w=500&h=400&s=1,Speciality & Gift Shops,"[6.52749185, 3.4442496]"
Muna,Military Museums,https://www.freeiconspng.com/thumbs/no-image-icon/no-image-icon-10.png,Military Museums,"[10.23061905, 9.94257395]"
Liquor Etc,Department Stores,https://www.freeiconspng.com/thumbs/no-image-icon/no-image-icon-10.png,Department Stores,"[6.4439906, 3.5081606]"
St John’s Anglican Church,Churches & Cathedrals,https://www.freeiconspng.com/thumbs/no-image-icon/no-image-icon-10.png,Churches & Cathedrals,"[7.12379485, 4.14246025]"
Beauty Addict,"Very nice staff, very clean and nice parlor! The haircut was perfect and the massage amazing. Thank you very much. I...",https://dynamic-media-cdn.tripadvisor.com/media/photo-o/0a/25/07/ae/getlstd-property-photo.jpg?w=500&h=400&s=1,Spas,"[9.0494025, 7.4469632]"
Constance And Sons Gallery,Art Galleries,https://www.freeiconspng.com/thumbs/no-image-icon/no-image-icon-10.png,Art Galleries,"[7.3939028, 3.8139187]"
Escape Room Nigeria,"My trip to the escape room literally transformed me into a detective, it's a super interesting experience and I think I...",https://dynamic-media-cdn.tripadvisor.com/media/photo-o/0b/a8/68/c1/getlstd-property-photo.jpg?w=500&h=400&s=1,Escape Games,"[7.7933373, 5.36101215]"
New Afrika Shrine,"Felas music is fabolous too. and I can imagine, if there is a good life performance, you forget everything else around...",https://dynamic-media-cdn.tripadvisor.com/media/photo-o/08/d0/e6/77/new-afrika-shrine.jpg?w=500&h=-1&s=1,Concerts • Dance Clubs & Discos,"[6.6227881, 3.3565754]"
Moeshen Art Gallery,Art Galleries,https://www.freeiconspng.com/thumbs/no-image-icon/no-image-icon-10.png,Art Galleries,"[9.086225, 7.3908531]"
Seal Team Paintball,"Yes the 21years and under folks had fun but it was a real blast for us all. Your staff was courteous, fun (yet firm...",https://dynamic-media-cdn.tripadvisor.com/media/photo-o/1d/1f/df/1e/war-ready.jpg?w=500&h=-1&s=1,Shooting Ranges,"[6.4245662, 3.4559183]"
Leilas Mobile Massage,Very nice interior design and great ambience. The hotel my wife and I were staying at was charging too much per person...,https://dynamic-media-cdn.tripadvisor.com/media/photo-o/2a/01/8e/66/caption.jpg?w=500&h=400&s=1,Spas,"[7.0190467, 6.09617725]"
Filmhouse IMAX Lekki,Enjoyed my movie and meal. Itwas my first time. Im glad i didn't regret it. I was going to pick other cinemas. But...,https://dynamic-media-cdn.tripadvisor.com/media/photo-o/0d/e5/9b/87/panini-and-fries.jpg?w=500&h=400&s=1,Cinemas,"[6.439276, 3.4710957]"
Brandskon,Libraries,https://www.freeiconspng.com/thumbs/no-image-icon/no-image-icon-10.png,Libraries,"[6.56545, 3.3708405]"
The Soul Lounge,Steak was very good and portions are big. Price quality index is very good. Service is good.,https://dynamic-media-cdn.tripadvisor.com/media/photo-o/09/43/77/d5/the-best-jollof-rice.jpg?w=500&h=400&s=1,Bars & Clubs,"[7.78334435, 5.40216615]"
Apples And Oranges Total Body Therapy,Great hair and spa service. I had the most relaxing massage. I highly recommend 👍🏻👍🏻,https://dynamic-media-cdn.tripadvisor.com/media/photo-o/13/60/82/56/spa.jpg?w=500&h=400&s=1,Spas,"[6.4354328, 3.4363672]"
Magnus Paintball Game Arena,"Went on a day when they had some sort of tournament at Liberty Stadium.Yes, their normal location is at Agodi Gardens...",https://dynamic-media-cdn.tripadvisor.com/media/photo-o/13/7a/94/cf/magnus-paintball-game.jpg?w=500&h=400&s=1,Game & Entertainment Centres,"[7.4082861, 3.9009685]"
Upbeat Recreation Centre,Game & Entertainment Centres,https://dynamic-media-cdn.tripadvisor.com/media/photo-o/1d/d9/ff/3f/tumble-like-a-butterfly.jpg?w=500&h=400&s=1,Game & Entertainment Centres,"[6.4536803, 3.4699331]"
Kada Cinemas,It is a must visit hotspot for fun seekers in the South South and Nigeria at large and a destination for tourists....,https://dynamic-media-cdn.tripadvisor.com/media/photo-o/16/28/6a/16/kada-cinemas.jpg?w=500&h=400&s=1,Cinemas,"[6.3154907, 5.6280627]"
Barazahi,By far the best hammam I’ve done so far. Will recommend it to everyone. Very great ambience and the customer service...,https://dynamic-media-cdn.tripadvisor.com/media/photo-o/10/35/97/e2/changing-room.jpg?w=500&h=-1&s=1,Spas,"[6.442386, 3.4671924]"
Federal palace hotel pool club,"It's clean, my children enjoy spending Saturdays and Sundays there. I have a 2 and 5 yr old. Members get to bring...",https://dynamic-media-cdn.tripadvisor.com/media/photo-o/06/1c/17/a9/federal-palace-hotel.jpg?w=500&h=400&s=1,Bars & Clubs,"[6.430767, 3.40751]"
Kidzmania Play Zone,Game & Entertainment Centres,https://www.freeiconspng.com/thumbs/no-image-icon/no-image-icon-10.png,Game & Entertainment Centres,"[6.5224505, 3.38942635]"
Kokopelli Gallery,Art Galleries,https://www.freeiconspng.com/thumbs/no-image-icon/no-image-icon-10.png,Art Galleries,"[6.4419084, 3.4135015]"
"Onikan House, Lagos",History Museums,https://dynamic-media-cdn.tripadvisor.com/media/photo-o/2c/09/27/a8/the-onikan-house-where.jpg?w=500&h=400&s=1,History Museums,"[6.4448275, 3.4047847]"
Esoteric Designs Store,Art Galleries • Antique Shops,https://www.freeiconspng.com/thumbs/no-image-icon/no-image-icon-10.png,Art Galleries • Antique Shops,"[6.44094575, 3.4068112]"
Spa Intercontinental,So after the humid sun n traffic jam of lagos you need a break n relaxant... the answer is the inter continental😁...,https://dynamic-media-cdn.tripadvisor.com/media/photo-o/20/e5/9b/c0/spa-intercontinental.jpg?w=500&h=400&s=1,Spas,"[5.6851131, 5.2054564]"
Sweet Brook Massage Spa,Spas,https://dynamic-media-cdn.tripadvisor.com/media/photo-o/11/9f/4d/cf/massage-spa-in-ikeja.jpg?w=500&h=400&s=1,Spas,"[6.5969181, 3.3452286]"
VR place Nigeria,Game & Entertainment Centres,https://dynamic-media-cdn.tripadvisor.com/media/photo-o/28/a6/c8/27/the-one-stop-hub-for.jpg?w=500&h=400&s=1,Game & Entertainment Centres,"[6.427587, 3.4258055]"
Tinapa,"I am utterly speechless by what I saw, although located at a very remote village in calabar, I have never seen a fog...",https://dynamic-media-cdn.tripadvisor.com/media/photo-o/12/1b/a3/f0/caption.jpg?w=500&h=400&s=1,Speciality & Gift Shops,"[9.082, 8.6753]"
Dallas Leisure World,Game & Entertainment Centres,https://dynamic-media-cdn.tripadvisor.com/media/photo-o/19/e9/c7/98/kids-loved-it-in-dallas.jpg?w=500&h=400&s=1,Game & Entertainment Centres,"[9.082, 8.6753]"
Baraka,"Baraka is one of the fab things to happen to Port Harcourt's restaurant/ food sector. With a really nice decor, you can...",https://dynamic-media-cdn.tripadvisor.com/media/photo-o/05/1d/ea/ff/baraka-grill.jpg?w=500&h=400&s=1,Dinner Theatres,"[8.2304057, 5.61922345]"
MB Hammam Spa,This is my fave spa for Moroccan Hammam and Balinese Massage. Its a LADIES ONLY Spa and also has a GYM and their...,https://dynamic-media-cdn.tripadvisor.com/media/photo-o/0a/f3/2d/69/lounge.jpg?w=500&h=400&s=1,Spas,"[9.0611075, 7.4828924]"
Smart Care Massage,Open now,https://dynamic-media-cdn.tripadvisor.com/media/photo-o/1b/88/2a/66/smart-care-massage.jpg?w=500&h=-1&s=1,Spas,"[9.0338725, 8.677457]"
Gratitude Massage Spa,What a wonderful place to be. Had the best massage experience ever.will definitely come back again .,https://dynamic-media-cdn.tripadvisor.com/media/photo-o/23/be/09/7d/foot-reflexology.jpg?w=500&h=400&s=1,Spas,"[9.0817351, 7.4792812]"
Escape Room 33,The entire experience was super fun. We managed our ‘escape’ within 60 minutes but found it surprisingly tough! The...,https://dynamic-media-cdn.tripadvisor.com/media/photo-o/21/cb/35/4d/sherlock-holmes-and-ark.jpg?w=500&h=400&s=1,Escape Games • Game & Entertainment Centres,"[6.4282596, 3.4084581]"
Viva Cinemas,"Its only downside is that, the timing of the films could be better displayed on electronic boards or on promotional...",https://dynamic-media-cdn.tripadvisor.com/media/photo-o/0a/3f/ab/b8/viva-lobby.jpg?w=500&h=-1&s=1,Cinemas,"[6.97850925, 3.5602757]"
Principle Legal Consult,Civic Centres,https://www.freeiconspng.com/thumbs/no-image-icon/no-image-icon-10.png,Civic Centres,"[9.0523553, 7.4464485]"
Metro Taxi,"The new Metro Taxi is a welcome addition to life in Lagos. The taxis are new, air conditioned, and with good drivers.",https://dynamic-media-cdn.tripadvisor.com/media/photo-o/08/1e/8b/04/getlstd-property-photo.jpg?w=500&h=400&s=1,Taxis & Shuttles,"[6.5882154, 3.363928]"
Hexagon,"Good place where to spend the night, nice girls all around. Unforgetable long white night. Easy to reach, reasonable...",https://dynamic-media-cdn.tripadvisor.com/media/photo-o/10/ac/48/30/20170913-202342-largejpg.jpg?w=500&h=-1&s=1,Bars & Clubs • Dance Clubs & Discos,"[8.37166745, 5.8863536]"
Kwinbee's Beauty Palace & Clinic,"The first place I always visit once I’m in town, best with every service most especially massage section...",https://dynamic-media-cdn.tripadvisor.com/media/photo-o/19/f1/db/75/nailed-it.jpg?w=500&h=400&s=1,Spas,"[9.0794704, 7.485469]"
Oso Lounge,"Great place to chill and party, the ambience is nice, the cocktails and food are excellent. The staffs are well trained.",https://dynamic-media-cdn.tripadvisor.com/media/photo-o/2b/a8/f5/b1/caption.jpg?w=500&h=400&s=1,Bars & Clubs,"[9.0790383, 7.4798505]"
Club Joker,The environment is cosy and great for couples to hang out not a place for kids to tag along. Downside their restroom is...,https://dynamic-media-cdn.tripadvisor.com/media/photo-o/15/da/8c/18/benin-city.jpg?w=500&h=400&s=1,Bars & Clubs • Karaoke Bars,"[6.2824392, 5.6306214]"
Bioviva Holistic Spa,The experience was good. I really enjoyed the treat and the services. The workers were amazing and professional.,https://dynamic-media-cdn.tripadvisor.com/media/photo-o/2a/29/c7/44/caption.jpg?w=500&h=400&s=1,Hammams & Turkish Baths • Roman Baths,"[6.5419865, 3.3322727]"
The Creatives By SPNL,Game & Entertainment Centres,https://www.freeiconspng.com/thumbs/no-image-icon/no-image-icon-10.png,Game & Entertainment Centres,"[9.082, 8.6753]"
Samap Travels & Tours LTD,Cooking Classes • Food Tours,https://dynamic-media-cdn.tripadvisor.com/media/photo-o/29/d2/f2/5c/caption.jpg?w=500&h=400&s=1,Cooking Classes • Food Tours,"[6.5995971, 3.3470581]"
Lilburn Health & Fitness Center,The best gym in the east. Very good equipments with a splendid customer service. Definitely one of the best places to...,https://dynamic-media-cdn.tripadvisor.com/media/photo-o/10/07/34/f0/great-place-great-people.jpg?w=500&h=400&s=1,Health Clubs • Spas,"[6.4607131, 7.5502752]"
Tirta Ayu Spa,"This has to be by far the best spa in Lagos I've ever experienced. Trained therapists, cozy environment, warm welcoming...",https://dynamic-media-cdn.tripadvisor.com/media/photo-o/0f/da/15/4c/getlstd-property-photo.jpg?w=500&h=400&s=1,Spas,"[7.73695835, 5.47648095]"
Fifth Chukker Polo and Resort,"I didn’t actually stay here. I took a tour and was impressed. The villas and huts are spacious, clean and feels like...",https://dynamic-media-cdn.tripadvisor.com/media/photo-o/15/3c/f1/93/nice-place-for-relaxing.jpg?w=500&h=400&s=1,Horseback Riding Tours,"[10.7010847, 7.5276059]"
Laguna Beach Club,1 only because the atmosphere was good. The location is beautiful but the service is terrible. It took 1 1/2 hours to...,https://www.freeiconspng.com/thumbs/no-image-icon/no-image-icon-10.png,Beach & Pool Clubs,"[6.46593595, 3.60242365]"
Koko Lounge,Comedy night in particular is great to get into the Lagos vibe. The e centre is a secure place and the club itself has...,https://dynamic-media-cdn.tripadvisor.com/media/photo-o/0a/34/6a/02/hi-i-m-fabian-buh-ma.jpg?w=500&h=-1&s=1,Bars & Clubs,"[7.77227515, 7.8189701]"
The Boss Lounge,There were good pool tables. The crowd is a mix of young and middle aged people from all walks of life. Cold drinks...,https://www.freeiconspng.com/thumbs/no-image-icon/no-image-icon-10.png,Bars & Clubs,"[5.7244608, 5.1668442]"
Barcode Lounge Kaduna,"Barcode is a place of class, style, fun, finesse, swag. Where the movers and shakers of the town hang out. From the...",https://dynamic-media-cdn.tripadvisor.com/media/photo-o/1a/de/69/73/img-20200202-wa0048-largejpg.jpg?w=500&h=400&s=1,Bars & Clubs,"[10.4687666, 7.4251276]"
Elitebox Fitness,"A place to learn boxing and keep fit, No1 boxing home",https://dynamic-media-cdn.tripadvisor.com/media/photo-o/25/11/d7/a0/yaaaaaaayyaaaaaaayyaaaaaaayyaa.jpg?w=500&h=400&s=1,Health Clubs,"[6.434496, 3.4249125]"
Peace Mass Transit,This is by far the worst transport service I have ever encountered so far . i took a peace mass transit bus heading to...,https://dynamic-media-cdn.tripadvisor.com/media/photo-o/1c/e4/04/34/peace-mass-transit.jpg?w=500&h=400&s=1,Public Transportation Systems,"[9.0685947, 7.4409571]"
Biyou Spa,I was overly satisfied. The neatness and serenity of the environment was my first attraction. The staff generally  were...,https://dynamic-media-cdn.tripadvisor.com/media/photo-o/1d/7c/45/b2/beautiful-serene-spaa.jpg?w=500&h=400&s=1,Spas,"[6.618829, 3.359429]"
The Spa at True U,Spas,https://dynamic-media-cdn.tripadvisor.com/media/photo-o/06/db/c8/7b/the-spa-at-true-u.jpg?w=500&h=400&s=1,Spas,"[9.0338725, 8.677457]"
Blue Edge Night Club,"Had a great time with friends and people were very friendly, atmosphere was great and cordial. Cracking place",https://dynamic-media-cdn.tripadvisor.com/media/photo-o/1c/27/a8/91/nigeria.jpg?w=500&h=400&s=1,Bars & Clubs • Dance Clubs & Discos,"[5.5401191, 5.7783258]"
Ucomeafrik,"Confidence, Alex and Vincent were fantastic, I wish my trip was longer.",https://dynamic-media-cdn.tripadvisor.com/media/photo-o/14/ca/c3/61/caption.jpg?w=500&h=400&s=1,Multi-day Tours • Walking Tours,"[5.6240098, -0.0867386]"
Grey And Glow Spa,"Wonderful experience, can't wait to go back. Relaxation at its peak,  I highly recommend Moroccan hamman bath and...",https://dynamic-media-cdn.tripadvisor.com/media/photo-o/27/5d/f4/28/spend-a-day-in-the-spa.jpg?w=500&h=400&s=1,Spas,"[6.5815768, 3.34707135]"
Blue Edge Night Club,"Had a great time with friends and people were very friendly, atmosphere was great and cordial. Cracking place",https://dynamic-media-cdn.tripadvisor.com/media/photo-o/1c/27/a8/91/nigeria.jpg?w=500&h=400&s=1,Bars & Clubs • Dance Clubs & Discos,"[5.5401191, 5.7783258]"
Ucomeafrik,"Confidence, Alex and Vincent were fantastic, I wish my trip was longer.",https://dynamic-media-cdn.tripadvisor.com/media/photo-o/14/ca/c3/61/caption.jpg?w=500&h=400&s=1,Multi-day Tours • Walking Tours,"[5.6240098, -0.0867386]"
Grey And Glow Spa,"Wonderful experience, can't wait to go back. Relaxation at its peak,  I highly recommend Moroccan hamman bath and...",https://dynamic-media-cdn.tripadvisor.com/media/photo-o/27/5d/f4/28/spend-a-day-in-the-spa.jpg?w=500&h=400&s=1,Spas,"[6.5815768, 3.34707135]"
Kryxtal Lounge,"However, the company can be, especially if you're a Westerner. Make sure you agree the price with the young lady before...",https://www.freeiconspng.com/thumbs/no-image-icon/no-image-icon-10.png,Bars & Clubs,"[9.0759148, 7.4631772]"
Flawless Skin by Abby Medspa,"The spa is an amazing place to be, great services, friendly staff and awesome ambiance. Flawless skin by Abby med spa...",https://dynamic-media-cdn.tripadvisor.com/media/photo-o/10/61/c8/a6/1-medspa-in-abuja-botox.jpg?w=500&h=400&s=1,Spas,"[9.0770803, 7.4646028]"
House of Tay Spa,Spas,https://dynamic-media-cdn.tripadvisor.com/media/photo-o/10/b2/9b/7c/jacuzzi-candle-light.jpg?w=500&h=400&s=1,Spas,"[6.6059112, 3.3511445]"
SOMA Kiddies Empire Limited,Open now,https://www.freeiconspng.com/thumbs/no-image-icon/no-image-icon-10.png,Speciality & Gift Shops • Shopping Malls,"[6.2057549, 6.8300141]"
Hazam,"A place for genuine and quality products. phones accessories, tablets etc.good customercare and reception by the...",https://dynamic-media-cdn.tripadvisor.com/media/photo-o/1a/e8/d7/0a/hazam.jpg?w=500&h=-1&s=1,Speciality & Gift Shops,"[12.000559, 8.5446735]"
Signature Nigeria,The location of this joint is good and easy to access. There are a variety of foods. You can use this place for lunch...,https://dynamic-media-cdn.tripadvisor.com/media/photo-o/16/60/cb/97/the-front-office-at-autograph.jpg?w=500&h=400&s=1,Spas,"[8.1617657, 6.10204065]"
Alali,"Had an amazing time here, it’s a very cozy space and the team in charge were very nice and friendly. I’d definitely...",https://dynamic-media-cdn.tripadvisor.com/media/photo-o/28/24/fa/ad/alali-boutique-styled.jpg?w=500&h=400&s=1,Paint & Pottery Studios,"[8.0331691, 4.9828253]"
W Bar Lounge Lagos,Bars & Clubs,https://www.freeiconspng.com/thumbs/no-image-icon/no-image-icon-10.png,Bars & Clubs,"[6.4420667, 3.4272902]"
Smart Care Massage,The massage therapist was professional and polite. I have never had such a wonderful massage session before.,https://dynamic-media-cdn.tripadvisor.com/media/photo-o/2b/f4/14/a8/caption.jpg?w=500&h=400&s=1,Spas,"[9.0338725, 8.677457]"
SOK Lounge,"On the outside, there is a live band stand where various types of music is sang by the in-house musician. There is a...",https://www.freeiconspng.com/thumbs/no-image-icon/no-image-icon-10.png,Bars & Clubs,"[4.8122605, 6.9984137]"
Dee Peak Spa,Spas,https://www.freeiconspng.com/thumbs/no-image-icon/no-image-icon-10.png,Spas,"[6.8253072, 3.92069265]"
Tirta Ayu Spa,"My therapist was YURI. Yuri was a total gem; pleasant, jovial and so sweet. She's from Indonesia. Yuri proceeded to...",https://dynamic-media-cdn.tripadvisor.com/media/photo-o/1c/34/2d/ff/getlstd-property-photo.jpg?w=500&h=400&s=1,Spas,"[7.73695835, 5.47648095]"
RHOMTRIP,Taxis & Shuttles,https://dynamic-media-cdn.tripadvisor.com/media/photo-o/1a/19/f5/74/caption.jpg?w=500&h=400&s=1,Taxis & Shuttles,"[9.082, 8.6753]"
Danza Travels and Tours,I came across their beautiful blog site and made contact right away. It was a wonderful experience; they took care of...,https://dynamic-media-cdn.tripadvisor.com/media/photo-o/18/7c/44/1c/caption.jpg?w=500&h=400&s=1,Taxis & Shuttles,"[6.4422289, 7.5370574]"
Quintessence,Located in an upscale residential neighborhood is a long-term Lagos establishment. Used to be in the central location...,https://dynamic-media-cdn.tripadvisor.com/media/photo-o/1d/48/e4/2e/indigo.jpg?w=500&h=400&s=1,Speciality & Gift Shops,"[6.46720725, 3.4946244]"
Ebonylife Cinemas,Overall it was a worthwhile experience and I'll likely go back as long as the standard is maintained....,https://dynamic-media-cdn.tripadvisor.com/media/photo-o/1d/8f/63/b7/our-screening-rooms-are.jpg?w=500&h=400&s=1,Cinemas,"[6.4248314, 3.4280119]"
Amaryadotcom Spa and Wellness,I enjoyed the excellent Spa session. The staff are well trained and respond quickly to enquiries. I would like to go...,https://dynamic-media-cdn.tripadvisor.com/media/photo-o/28/c4/d7/3c/welcome-to-amaryadotcom.jpg?w=500&h=400&s=1,Health Clubs • Spas,"[9.096201, 7.4893442]"
Tirta Ayu Spa Abuja,"About 21 Waxing options are available at Tirta Ayu Spa, as well as Acrylic/Nail Polish and Eyelash Services. So as you...",https://dynamic-media-cdn.tripadvisor.com/media/photo-o/1c/4b/1a/19/thai-massage.jpg?w=500&h=400&s=1,Spas,"[9.0446259, 7.5153013]"
Filmhouse Cinemas,Cinemas,https://www.freeiconspng.com/thumbs/no-image-icon/no-image-icon-10.png,Cinemas,"[8.3767419, 5.94616395]"
Topaz house of beauty,"Nice place I really enjoyed the deep tissue massage, the therapist was professional and light refreshment was given...",https://www.freeiconspng.com/thumbs/no-image-icon/no-image-icon-10.png,Spas,"[9.0341427, 7.5034154]"
CitiDrive,Taxis & Shuttles,https://dynamic-media-cdn.tripadvisor.com/media/photo-o/0c/dc/fe/34/travel-in-style-safety.jpg?w=500&h=400&s=1,Taxis & Shuttles,"[6.4287624, 3.4391238]"
Cube Spa Maryland,Spas,https://dynamic-media-cdn.tripadvisor.com/media/photo-o/1a/c7/1f/6f/they-are-having-a-swell.jpg?w=500&h=400&s=1,Spas,"[6.5696152, 3.3753015]"
Body Signal Arabian Spa,"very warm reception, the staff are friendly and the spa smells so nice 🥰🥰 also they did a very great job",https://www.freeiconspng.com/thumbs/no-image-icon/no-image-icon-10.png,Spas,"[6.4350963, 3.4690163]"
House of Deola,"The ambiance is great, great customer service team. Perfect tailoring and premium service. I got my order and the fit...",https://dynamic-media-cdn.tripadvisor.com/media/photo-o/12/47/d3/43/iconic-fashion-designer.jpg?w=500&h=400&s=1,Speciality & Gift Shops,"[7.09784875, 4.91581135]"
Andrea Iyamah,Could not leave Lagos without a stop at Andrea Iyamah's lovely Lagos store. They have all of the latest collection's...,https://www.freeiconspng.com/thumbs/no-image-icon/no-image-icon-10.png,Speciality & Gift Shops,"[6.4301764, 3.4292391]"
Yb Cocoon Day Spa,"A very cozy and peaceful environment. Whenever you need to cool off from Lagos stress, just book a spa session with them",https://www.freeiconspng.com/thumbs/no-image-icon/no-image-icon-10.png,Spas,"[6.4391768, 3.4633728]"
3AD Premium Lounge,"Simply the best experience at a bar, the environment is good and spacious also the management team are great  with a...",https://dynamic-media-cdn.tripadvisor.com/media/photo-o/28/b8/e7/64/3ad-premium-lounge-view.jpg?w=500&h=400&s=1,Bars & Clubs,"[6.6024835, 3.3101638]"
Swimpro,Sports Camps & Clinics,https://dynamic-media-cdn.tripadvisor.com/media/photo-o/18/7b/05/b4/aqua-aerobics-lessons.jpg?w=500&h=400&s=1,Sports Camps & Clinics,"[6.451543, 3.4354822]"
Pickmeup International Company Ltd.,Open now,https://dynamic-media-cdn.tripadvisor.com/media/photo-o/19/81/cb/6b/caption.jpg?w=500&h=400&s=1,Taxis & Shuttles,"[5.5426845, 5.7672796]"
MitiMeth,I visited MitiMeth to pick up souvenirs during my last visit to Nigeria. I was pleasantly surprised by the selection of...,https://dynamic-media-cdn.tripadvisor.com/media/photo-o/25/fb/b2/00/shop-local-shop-handmade.jpg?w=500&h=400&s=1,Speciality & Gift Shops,"[6.444635, 3.4280249]"
Zinkata,Run don't walk to Zinkata for the best selection of local Nigerian designers. Both women and men alike can find unique...,https://www.freeiconspng.com/thumbs/no-image-icon/no-image-icon-10.png,Speciality & Gift Shops,"[6.4495122, 3.4743218]"
Jodeci Lounge kaduna,Bars & Clubs,https://dynamic-media-cdn.tripadvisor.com/media/photo-o/1b/57/ec/97/where-luxury-meets-lifestyle.jpg?w=500&h=400&s=1,Bars & Clubs,"[10.4699186, 7.4360121]"
Charisma Cosmetics,Spas,https://dynamic-media-cdn.tripadvisor.com/media/photo-o/13/84/a1/cb/getlstd-property-photo.jpg?w=500&h=400&s=1,Spas,"[9.2266776, 5.93582615]"
Aimas,From the moment your car passes through Aimas gates you are whisked into a peaceful and tranquil environment. With...,https://www.freeiconspng.com/thumbs/no-image-icon/no-image-icon-10.png,Speciality & Gift Shops,"[6.4504864, 3.4497652]"
Emmy Kasbit,What a lovely treat to be able to visit Emmy Kasbit's studio during our last visit to Lagos. The designer was in store...,https://www.freeiconspng.com/thumbs/no-image-icon/no-image-icon-10.png,Speciality & Gift Shops,"[6.4290951, 3.4865536]"
Artisan Lounge & Bar,Bars & Clubs,https://www.freeiconspng.com/thumbs/no-image-icon/no-image-icon-10.png,Bars & Clubs,"[6.4317384, 3.4150165]"
Rejuvenee Spa,Spas,https://dynamic-media-cdn.tripadvisor.com/media/photo-o/1b/47/60/ac/couples-room.jpg?w=500&h=400&s=1,Spas,"[6.586193, 3.3559881]"
Venus Aesthetics,Escape Games,https://dynamic-media-cdn.tripadvisor.com/media/photo-o/1b/2c/1f/85/caption.jpg?w=500&h=400&s=1,Escape Games,"[9.04059235, 7.5251296]"
Tokyo Nightlife Abuja,Bars & Clubs,https://dynamic-media-cdn.tripadvisor.com/media/photo-o/27/9f/78/73/tna.jpg?w=500&h=400&s=1,Bars & Clubs,"[9.0716934, 7.4901325]"
Facial Bar MedSpa,Spas,https://dynamic-media-cdn.tripadvisor.com/media/photo-o/1c/57/a8/12/from-innovative-beauty.jpg?w=500&h=400&s=1,Spas,"[6.4250906, 3.4133232]"
Moffi Power Planet Ltd.,Speciality & Gift Shops,https://www.freeiconspng.com/thumbs/no-image-icon/no-image-icon-10.png,Speciality & Gift Shops,"[4.9768308, 8.3412774]"
YoBella Kids Zone,Speciality & Gift Shops,https://dynamic-media-cdn.tripadvisor.com/media/photo-o/1b/39/06/a1/yobella-kids-zone.jpg?w=500&h=400&s=1,Speciality & Gift Shops,"[9.07775055, 7.4535361]"
Sanusparaquam Wellness,Open now,https://dynamic-media-cdn.tripadvisor.com/media/photo-o/2b/2e/ad/ad/the-most-stylish-and.jpg?w=500&h=400&s=1,Spas,"[9.0736084, 7.4355264]"
The Mane Place,Spas,https://dynamic-media-cdn.tripadvisor.com/media/photo-o/03/ff/4b/56/getlstd-property-photo.jpg?w=500&h=400&s=1,Spas,"[9.67696885, 9.3177717]"
Your Spa & Fitness,Spas,https://www.freeiconspng.com/thumbs/no-image-icon/no-image-icon-10.png,Spas,"[7.09352125, 5.40177445]"
Afolake Adeniran,Spas,https://www.freeiconspng.com/thumbs/no-image-icon/no-image-icon-10.png,Spas,"[9.082, 8.6753]"
RHOMTRIP,Taxis & Shuttles,https://dynamic-media-cdn.tripadvisor.com/media/photo-o/1a/11/0d/6e/caption.jpg?w=500&h=400&s=1,Taxis & Shuttles,"[9.082, 8.6753]"
Detente Wellness Haven,Yoga & Pilates • Spas,https://dynamic-media-cdn.tripadvisor.com/media/photo-o/16/74/6f/39/getlstd-property-photo.jpg?w=500&h=-1&s=1,Yoga & Pilates • Spas,"[6.4734411, 3.5793542]"
